{
  "lessonId": "home",
  "mode": "tts",
  "audioSrc": null,
  "voice": {
    "lang": "pt-BR",
    "name": null,
    "rate": 1,
    "pitch": 1
  },
  "segments": [
    {
      "blockId": "visao-geral",
      "start": 0,
      "end": 10
    },
    {
      "blockId": "o-que-voce-vai-encontrar",
      "start": 10,
      "end": 22
    },
    {
      "blockId": "como-usar",
      "start": 22,
      "end": 32
    }
  ]
}
