{
  "lessonId": "comece-aqui",
  "mode": "tts",
  "audioSrc": null,
  "voice": {
    "lang": "pt-BR",
    "name": null,
    "rate": 1,
    "pitch": 1
  },
  "segments": [
    {
      "blockId": "intro",
      "start": 0,
      "end": 10
    },
    {
      "blockId": "mapa-mental",
      "start": 10,
      "end": 24
    },
    {
      "blockId": "mercado",
      "start": 24,
      "end": 35
    }
  ]
}
