{
  "lessonId": "ia-mercado-e-oportunidade",
  "mode": "tts",
  "audioSrc": null,
  "voice": {
    "lang": "pt-BR",
    "name": null,
    "rate": 1,
    "pitch": 1
  },
  "segments": [
    {
      "blockId": "o-medo-e-real-mas-precisa-ser-organizado",
      "start": 0,
      "end": 18
    },
    {
      "blockId": "o-que-muda-com-ia",
      "start": 18,
      "end": 34
    },
    {
      "blockId": "por-que-ainda-vale-a-pena",
      "start": 34,
      "end": 50
    },
    {
      "blockId": "como-usar-ia-como-apoio",
      "start": 50,
      "end": 68
    }
  ]
}
