{
  "lessonId": "fundamentos-tecnologia",
  "mode": "tts",
  "audioSrc": null,
  "voice": {
    "lang": "pt-BR",
    "name": null,
    "rate": 1,
    "pitch": 1
  },
  "segments": [
    {
      "blockId": "mapa-basico",
      "start": 0,
      "end": 13
    },
    {
      "blockId": "conceitos-centrais",
      "start": 13,
      "end": 27
    },
    {
      "blockId": "por-que-isso-importa",
      "start": 27,
      "end": 38
    }
  ]
}
